Topic,PID,Document Title,Abstract,label
CD010438,8889419,Evaluation of the anticoagulant properties of aprotinin in vitro.,"Author information: (1)Department of Anaesthesiology, University Hospital Ghent, Belgium.",yes
CD010438,16221315,Mechanistic implications for the use and monitoring of recombinant activated factor VII in trauma.,"Author information: (1)US Army Institute of Surgical Research, Fort Sam Houston, Texas, USA. Anthony.pusateri@amedd.army.mil",yes
CD010438,7785150,[Thromboelastography of blood coagulation in patients with complicated nasal furunculosis].,"Bobrov VM, Shishkin SA.",yes
CD010438,22375889,Coagulopathy and hemostatic monitoring in cardiac surgery: an update.,"Author information: (1)Section for Transfusion Medicine, Capital Region Blood Bank, Rigshospitalet, University of Copenhagen, Denmark. per.johansson@rh.regionh.dk",yes
CD010438,9128188,In vitro paraoxon (E 600) exposure: no activating effect on human blood coagulation.,"Author information: (1)Department of Pharmacology, University of Heidelberg at Mannheim, Germany.",yes
CD010438,14742357,Hydroxyethyl starch as a priming solution for cardiopulmonary bypass impairs hemostasis after cardiac surgery.,"Author information: (1)Department of Anesthesia and Intensive Care Medicine, Helsinki University Central Hospital, Meilahti Hospital, Helsinki, Finland. anne.kuitunen@hus.fi",yes
CD010438,20614571,The effects of preloading infusion with hydroxyethyl starch 200/0.5 or 130/0.4 solution on hypercoagulability and excessive platelet activation of patients with colon cancer.,"Author information: (1)Department of Anesthesiology, Nanfang Hospital, Southern Medical University, Guangzhou, China. lhlh2003@126.com <lhlh2003@126.com>",yes
CD010438,21955460,"Reduced clot strength upon admission, evaluated by thrombelastography (TEG), in trauma patients is independently associated with increased 30-day mortality.","Author information: (1)Department of Clinical Immunology, Section for Transfusion Medicine, Rigshospitalet, Copenhagen University Hospital, Copenhagen, Denmark.",yes
CD010438,18844500,"Preanalytical effects of pneumatic tube transport on routine haematology, coagulation parameters, platelet function and global coagulation.","Author information: (1)Department of Medical Biosciences, Clinical Chemistry, Umeå University, Umeå, Sweden. olof.wallin@medbio.umu.se",yes
CD010438,21429567,Fibrin formation is more impaired than thrombin generation and platelets immediately following cardiac surgery.,"Author information: (1)Department of Anaesthesiology and Intensive Care, Salzburger Landeskliniken SALK, Salzburg, Austria. solomon.cristina@googlemail.com",yes
CD010438,8924744,[Changes in hemostasis during orthotopic liver transplantation and massive transfusion: a case report].,"Kozek-Langenecker SA(1), Müller CM, Felfernig M, Zimpfer M.",yes
CD010438,3619091,Effects of progressive blood loss on coagulation as measured by thrombelastography.,"The effects of progressive blood loss on coagulation were studied in 87 adults (age 23-66 yr) undergoing a variety of operations under general anesthesia. None had preoperative alterations in coagulation or liver function and none were receiving anticoagulant or antiplatelet medication. Whole blood coagulation status was quantitated using thrombelastography (TEG). Blood samples for TEG were obtained 5 min before and 15 min after induction of anesthesia, after each increment of blood loss (EBL) equalling 5% of estimated blood volume (EBV), at the end of surgery, and 2 hr post-operatively. Patients with EBL exceeding 0.15 EBV were given packed red cells and crystalloid solution. Patients with EBL less than 0.15 EBV received only crystalloid. Thrombelastography analysis showed a trend toward increased coagulability with progressive blood loss. Two of four patients with 80% loss of EBV maintained normal to enhanced coagulation status, although the other two developed clinical and thrombelastographic evidence of coagulopathy. Thrombelastography allowed rapid intraoperative diagnosis and specific treatment of loss of platelet activity in the latter two patients. We conclude that during moderate to massive blood loss, use of supplemental fresh frozen plasma and/or platelets should be reserved for patients with documented defects in coagulation. Thrombelastography is useful for the detection and management of coagulation defects associated with intraoperative blood loss.",yes
CD010438,19361030,Use of a thrombelastograph platelet mapping assay for diagnosis of clopidogrel resistance: a case report.,"Author information: (1)Department of Perfusion, Oakwood Hospital and Medical Center, Dearborn, Michigan, USA. jmorton.ioh@gmail.com",yes
CD010438,10781265,"Thromboelastography: past, present, and future.",Comment on   Anesthesiology. 2000 May;92(5):1242-9.,yes
CD010438,10475284,Use of abciximab-modified thrombelastography in patients undergoing cardiac surgery.,"Author information: (1)Department of Anesthesiology and General Intensive Care, University of Vienna, General Hospital Vienna, Austria. stephan.kettner@akh-wien.ac.at",yes
CD010438,17179819,Heparin-induced inhibitory effects of a prothrombin complex concentrate on global tests of haemostasis.,"Author information: (1)Department of Pediatrics, Nara Medical University, Kashihara, Nara, Japan.",yes
CD010438,17845651,Effects of albumin 5% and artificial colloids on clot formation in small infants.,"Author information: (1)Department of Anaesthesiology and Intensive Care Medicine, Innsbruck Medical University, Anichstrasse 35, 6020 Innsbruck, Austria. thorsten.haas@i-med.ac.at",yes
CD010438,4360448,[Plasmatic coagulation factors in hyperlipoproteinemias].,"Zöller H, Fromme K, Gross W.",yes
CD010438,7257238,"Recovery, life span, and function of stored plateletpheresis units.","Plateletpheresis units collected using the Haemonetics Model 30 or the IBM 2997 cell separator were stored for 24 h at 22 degrees C. Autologous recovery and life span measurements averaged 64 +/- 13% (1 SD) and 8.9 +/- 1.3 (1 SD) days. The hemostatic effectiveness of these preparations were satisfactory; the corrected increment 4-6 h and 18-24 posttransfusion was 20,400 and 13,400/microliter/m2, respectively, and the bleeding time showed improvement in each patient. There was no significant difference in these parameters between collection devices.",yes
CD010438,4075737,Lymphocytopenia in donors undergoing regular platelet apheresis with cell separators.,"The effect of regular platelet apheresis on lymphocyte count was investigated in 142 platelet donors who donated up to 113 times on Haemonetics Model 30 and Fenwal Model CS-3000 cell separators. Lymphocytopenia (lymphocyte count less than 0.9 X 10(9)/l) was found in 21 out of 113 (18.6%) donors who donated solely on the Haemonetics Model 30 compared with 2 out of 100 (2%) whole blood donors and none of 100 plasmapheresis donors (P less than 0.002). Lymphocyte count was inversely related to the total number of platelet donations (r = 0.51, P less than 0.001) and total estimated lymphocyte loss (r = 0.49, P less than 0.001) suggesting a cumulative effect. T4 and T8 lymphocyte subsets were found to be reduced in each of 13 lymphocytopenic platelet donors tested but T4/T8 ratios were similar to those of controls (2.51 +/- 0.79 and 2.33 +/- 0.58 respectively). No adverse effects on platelet donor health were observed but it is suggested that platelet apheresis protocols should be designed to minimize lymphocyte loss.",yes
CD010438,5269686,"[Antibacterial substances for the implantation into bone cavities and their effect on blood coagulation, by means of thrombelastography].","Schulte W, Wörner H.",yes
CD010438,20885299,Arteriovenous differences of hematological and coagulation parameters in patients with sepsis.,"Author information: (1)Department of Anesthesiology and Critical Care Medicine, Second Faculty of Medicine, Institute for Postgraduate Medical Education, Charles University, Prague, Czech Republic. durila4@yahoo.com",yes
